url issues,url_api comment,url_html comment,user create comment,body,created_at,updated_at
https://api.github.com/repos/hyperledger/indy-hipe/issues/111,https://api.github.com/repos/hyperledger/indy-hipe/issues/comments/479056631,https://github.com/hyperledger/indy-hipe/pull/111#issuecomment-479056631,dbluhm,[rendered text](https://github.com/dbluhm/indy-hipe/blob/testing-messages/text/testing-messages/README.md),2019-04-02 15:38:20,2019-04-02 15:38:20
https://api.github.com/repos/hyperledger/indy-hipe/issues/108,https://api.github.com/repos/hyperledger/indy-hipe/issues/comments/478164904,https://github.com/hyperledger/indy-hipe/pull/108#issuecomment-478164904,dhh1128,"Merging after approval from @swcurran and @mikelodder7 , and after previous discussions with @TelegramSam and @nage .",2019-03-29 22:10:51,2019-03-29 22:10:51
https://api.github.com/repos/hyperledger/indy-hipe/issues/107,https://api.github.com/repos/hyperledger/indy-hipe/issues/comments/475483204,https://github.com/hyperledger/indy-hipe/pull/107#issuecomment-475483204,dhh1128,"Per previous approval from multiple maintainers on rocket chat, I am going to go ahead and merge this change.",2019-03-22 03:38:02,2019-03-22 03:38:02
https://api.github.com/repos/hyperledger/indy-hipe/issues/107,https://api.github.com/repos/hyperledger/indy-hipe/issues/comments/475484598,https://github.com/hyperledger/indy-hipe/pull/107#issuecomment-475484598,dhh1128,This change was discussed and approved here: https://chat.hyperledger.org/channel/indy-agent?msg=Xes3cnmr4TvpgFjRC,2019-03-22 03:47:30,2019-03-22 03:47:30
https://api.github.com/repos/hyperledger/indy-hipe/issues/105,https://api.github.com/repos/hyperledger/indy-hipe/issues/comments/475438659,https://github.com/hyperledger/indy-hipe/pull/105#issuecomment-475438659,dhh1128,"@Artemkaaas , is your change here compatible with the change that @lovesh is recommending in this PR against indy-sdk? https://github.com/hyperledger/indy-sdk/pull/1537",2019-03-21 23:17:54,2019-03-21 23:17:54
https://api.github.com/repos/hyperledger/indy-hipe/issues/105,https://api.github.com/repos/hyperledger/indy-hipe/issues/comments/475501667,https://github.com/hyperledger/indy-hipe/pull/105#issuecomment-475501667,Artemkaaas,"@dhh1128, it's a different level. @lovesh suggested changes inside libindy `pack` function (how JSON object is built). ",2019-03-22 05:46:15,2019-03-22 05:46:15
https://api.github.com/repos/hyperledger/indy-hipe/issues/105,https://api.github.com/repos/hyperledger/indy-hipe/issues/comments/475613670,https://github.com/hyperledger/indy-hipe/pull/105#issuecomment-475613670,jovfer,"@dhh1128 this PR is just for clarification current approach and probably for minimal instant changes in codebase.

BTW I expect large update from @lovesh and large discussion around topic ""is it required and how to avoid re-encryption and re-base64 data while multiply rounds of pack and fwd""",2019-03-22 13:06:00,2019-03-22 13:06:28
https://api.github.com/repos/hyperledger/indy-hipe/issues/105,https://api.github.com/repos/hyperledger/indy-hipe/issues/comments/475774412,https://github.com/hyperledger/indy-hipe/pull/105#issuecomment-475774412,TelegramSam,"Can we update this to clarify that the msg is not a string but the json object? IE we want this: 
`""msg"": { ""protected"": ""..."", ... }`
and not this:
`""msg"": ""{ \""protected\"": \""....\"", .... }""`
",2019-03-22 20:39:34,2019-03-22 20:39:34
https://api.github.com/repos/hyperledger/indy-hipe/issues/105,https://api.github.com/repos/hyperledger/indy-hipe/issues/comments/479665564,https://github.com/hyperledger/indy-hipe/pull/105#issuecomment-479665564,dhh1128,@TelegramSam I am thinking this is ready to merge. Do you agree?,2019-04-03 21:27:50,2019-04-03 21:27:50
https://api.github.com/repos/hyperledger/indy-hipe/issues/100,https://api.github.com/repos/hyperledger/indy-hipe/issues/comments/471100812,https://github.com/hyperledger/indy-hipe/pull/100#issuecomment-471100812,kdenhartog,"Thanks for adding this documentation. An important premise that I realized when discussing this with members in the community is that repudiable integrity of data as the default maps very well to the real world. 

For example, when I'm in public I don't have a microphone following me around recording my every conversation and then using that to prove I said something. Only in very specific instances do we put things ""on the record"" so to say. In instances like public interviews, signing documents, and legal testimonies it's useful. However, we don't have an expectation that every conversation is recorded (ignoring the fact that I carry a cell phone with me), so it make sense that our technologies extend that paradigm.",2019-03-08 22:39:24,2019-03-08 22:39:24
https://api.github.com/repos/hyperledger/indy-hipe/issues/99,https://api.github.com/repos/hyperledger/indy-hipe/issues/comments/478109138,https://github.com/hyperledger/indy-hipe/pull/99#issuecomment-478109138,swcurran,"This question should be finalized on the next Indy Maintainers call:

> Is ""DIDComm"" the accepted term going forward?

If so, this should be merged immediately. ",2019-03-29 18:46:42,2019-03-29 18:46:42
https://api.github.com/repos/hyperledger/indy-hipe/issues/98,https://api.github.com/repos/hyperledger/indy-hipe/issues/comments/477242428,https://github.com/hyperledger/indy-hipe/pull/98#issuecomment-477242428,TelegramSam,I feel like this is ready for FCP. It doesn't answer all questions but is a fine foundation that can be amended through future HIPEs and PRs. ,2019-03-27 16:34:49,2019-03-27 16:34:49
https://api.github.com/repos/hyperledger/indy-hipe/issues/95,https://api.github.com/repos/hyperledger/indy-hipe/issues/comments/467916956,https://github.com/hyperledger/indy-hipe/pull/95#issuecomment-467916956,TelegramSam,"I'd like to drill down into why a connection may not be desired. Not contesting it yet, but I think we can learn a bit by the discussion.",2019-02-27 15:53:27,2019-02-27 15:53:27
https://api.github.com/repos/hyperledger/indy-hipe/issues/95,https://api.github.com/repos/hyperledger/indy-hipe/issues/comments/467921755,https://github.com/hyperledger/indy-hipe/pull/95#issuecomment-467921755,swcurran,"I think it is necessary based the number of connections that a person has - the volume of connections.  I have about 800 entries in my lastpass repo, so that is at least how many legit connections that a person might have, never mind trips to the liquor store, and pubs.",2019-02-27 16:05:06,2019-02-27 16:05:06
https://api.github.com/repos/hyperledger/indy-hipe/issues/95,https://api.github.com/repos/hyperledger/indy-hipe/issues/comments/468115575,https://github.com/hyperledger/indy-hipe/pull/95#issuecomment-468115575,tmarkovski,"A connection makes this challenge flow obsolete, as it is authentication in itself, with it's own challenge/response flow (connection protocol). I think the intention with this hipe's flow is to reduce the friction of connection establishment and allow transient authentication without establishing permanent connection. I think there are a lot of applications for ephemeral challenge, especially over offline networks (NFC, Bluetooth, etc).
@swcurran makes a good point, we don't want a connection entry for every authentication endpoint unless it's necessary for credential exchange, not just presentation.",2019-02-28 02:47:51,2019-02-28 02:47:51
https://api.github.com/repos/hyperledger/indy-hipe/issues/95,https://api.github.com/repos/hyperledger/indy-hipe/issues/comments/476234709,https://github.com/hyperledger/indy-hipe/pull/95#issuecomment-476234709,dhh1128,"After reading this HIPE draft, I am feeling like I need a better definition of the problem this protocol is solving.

What do we mean by ""ephemeral"" here? ""Connectionless""? If so, we should use ""connectionless"". Ephemeral means transitory or temporary, not connectionless.

I also don't know what we mean by ""challenge."" Are we imagining many different types of challenge can be plugged in? If so, how does that work? The only example I am seeing is a challenge for a proof request. So I am wondering if this is really the connectionless proof request protocol, and not the ephemeral challenge protocol.",2019-03-25 14:58:27,2019-03-25 14:58:27
https://api.github.com/repos/hyperledger/indy-hipe/issues/95,https://api.github.com/repos/hyperledger/indy-hipe/issues/comments/479124049,https://github.com/hyperledger/indy-hipe/pull/95#issuecomment-479124049,tplooker,"@dhh1128 Sorry I totally missed the comment on this. 

I called the protocol ephemeral challenge as it is an ""instantaneous"" challenge protocol (i.e no prior connection needed to host the protocol and no commitment passed responding to the challenge).

My thinking about why I called it a ""challenge"" protocol rather than a ""proof request"" protocol is that yes, I think in the very near future, even though I have not articulated this yet in the HIPE (hence it is only a draft) that there will be other forms of challenges. The most notable could be a pairwise challenge for example the challenger generates a challenge signed with their public did, a challenge responder receives and identifies the public did is linked to a peerwise connection they have in their wallet and responds with a challenge response that identifies them to the challenger. Although in the second challenge scenario I have outlined, a connection is required. This is not an artifact of the protocol it self rather the specific type of challenge creating that requirement.

Its important to note that this protocol has a large overlap with did-auth and I am still assessing its overlap.

In general what I am hoping to accomplish with this protocol is a general purpose challenge request-response protocol.",2019-04-02 18:03:48,2019-04-02 18:03:48
https://api.github.com/repos/hyperledger/indy-hipe/issues/95,https://api.github.com/repos/hyperledger/indy-hipe/issues/comments/479316767,https://github.com/hyperledger/indy-hipe/pull/95#issuecomment-479316767,tplooker,"@dhh1128 and any other interested parties, please take a look at the updated HIPE this is still a draft mainly designed to promote discussion around the concept. I have added an early example as to how a `proof of pairwise connection` could work.",2019-04-03 03:14:11,2019-04-03 03:14:11
https://api.github.com/repos/hyperledger/indy-hipe/issues/94,https://api.github.com/repos/hyperledger/indy-hipe/issues/comments/468315034,https://github.com/hyperledger/indy-hipe/pull/94#issuecomment-468315034,kdenhartog,"What's the extent of error handling that we want to cover with the transport layer. For example, would a misformatted wire message return a 4XX status code? I'd think that it wouldn't make sense to use the status code to push this error back.  On the other hand, what about a message that is posted to the wrong endpoint? I would think that it would be acceptable to return a 4XX status code.

Also, given that we support IoT devices I think it's only fair to support the 418 status code if we're interacting with a teapot. ",2019-02-28 15:27:32,2019-02-28 15:27:32
https://api.github.com/repos/hyperledger/indy-hipe/issues/94,https://api.github.com/repos/hyperledger/indy-hipe/issues/comments/469291775,https://github.com/hyperledger/indy-hipe/pull/94#issuecomment-469291775,TelegramSam,"> What's the extent of error handling that we want to cover with the transport layer. For example, would a misformatted wire message return a 4XX status code? I'd think that it wouldn't make sense to use the status code to push this error back. On the other hand, what about a message that is posted to the wrong endpoint? I would think that it would be acceptable to return a 4XX status code.

I do think we need to be careful here to not step into full message processing. Errors related to message _receipt_ might be acceptable though.

> Also, given that we support IoT devices I think it's only fair to support the 418 status code if we're interacting with a teapot.

Definitely need to work out the particulars of this one. :)
",2019-03-04 15:22:39,2019-03-04 15:22:39
https://api.github.com/repos/hyperledger/indy-hipe/issues/94,https://api.github.com/repos/hyperledger/indy-hipe/issues/comments/475440328,https://github.com/hyperledger/indy-hipe/pull/94#issuecomment-475440328,dhh1128,"Aside from the comments I left, my other point of feedback is just that I think we need discussion of a few more issues and transports before we merge this. For example:

1. How are different transports tested?
2. How mediators and relays relate to transports (need hyperlinks to that HIPE)
3. How message trust contexts might be affected by transports (or not).
4. How to standardize handling of a new transport. (By raising a PR against this doc? If so, what questions would the PR have to answer?)
5. Which transports have known implementations.",2019-03-21 23:25:40,2019-03-21 23:25:40
https://api.github.com/repos/hyperledger/indy-hipe/issues/93,https://api.github.com/repos/hyperledger/indy-hipe/issues/comments/475476992,https://github.com/hyperledger/indy-hipe/pull/93#issuecomment-475476992,kdenhartog,Closing this right now to focus on other HIPEs. We can revisit this later.,2019-03-22 02:58:05,2019-03-22 02:58:05
https://api.github.com/repos/hyperledger/indy-hipe/issues/89,https://api.github.com/repos/hyperledger/indy-hipe/issues/comments/461889567,https://github.com/hyperledger/indy-hipe/pull/89#issuecomment-461889567,TelegramSam,"I'm wondering what value the attachment approach brings, as opposed to just including the contents as an attribute?",2019-02-08 17:55:32,2019-02-08 17:55:32
https://api.github.com/repos/hyperledger/indy-hipe/issues/89,https://api.github.com/repos/hyperledger/indy-hipe/issues/comments/461924899,https://github.com/hyperledger/indy-hipe/pull/89#issuecomment-461924899,tplooker,"@TelegramSam I agree, my immediate thought was what happens when we add support for attachments i.e media in credentials and proofs? @KitHat was this driven by the need to have a generic credential exchange messages that spans multiple formats the W3VC space?",2019-02-08 19:49:14,2019-02-08 19:49:14
https://api.github.com/repos/hyperledger/indy-hipe/issues/89,https://api.github.com/repos/hyperledger/indy-hipe/issues/comments/462309881,https://github.com/hyperledger/indy-hipe/pull/89#issuecomment-462309881,KitHat,"@TelegramSam @tplooker as one of the reasons -- yes. It will be easier to become compliant with W3C credential format if we will keep it as attachment. Moreover, if libindy decides to evolve its format somehow it wont break this format.",2019-02-11 12:25:36,2019-02-11 12:25:36
https://api.github.com/repos/hyperledger/indy-hipe/issues/89,https://api.github.com/repos/hyperledger/indy-hipe/issues/comments/462478745,https://github.com/hyperledger/indy-hipe/pull/89#issuecomment-462478745,tplooker,"@Kithat ok thanks for the clarification, any comment on how we would handle media in credentials? 

My concern with pushing the credential into an attachment is where do we then define the indy credential attachment format  some where that is visible as a message spec for someone to add support for? My thinking is message families are meant to be this source of definition and also support versioning so therefore we shouldn't be pushing this message definition into an attachment.",2019-02-11 20:18:38,2019-02-11 20:18:38
https://api.github.com/repos/hyperledger/indy-hipe/issues/89,https://api.github.com/repos/hyperledger/indy-hipe/issues/comments/462763931,https://github.com/hyperledger/indy-hipe/pull/89#issuecomment-462763931,KitHat,"@tplooker what is the problem with media in credential? It is supported in libindy right now, if you can map it to integer to support ZKP-related math (hash it, for example)

What about format, right now it is defined this format on libindy level. If someone wants to use it somehow, they have two options:
* Use libindy to work with them
* Make their own library that will work with these formats.

Maybe libindy is not the best place to define this format, and it is mentioned in HIPE that it might be created as a MIME type in W3C. I think that @dhh1128 is the best person to discuss it.",2019-02-12 13:43:53,2019-02-12 13:44:05
https://api.github.com/repos/hyperledger/indy-hipe/issues/89,https://api.github.com/repos/hyperledger/indy-hipe/issues/comments/463008013,https://github.com/hyperledger/indy-hipe/pull/89#issuecomment-463008013,tplooker,"@KitHat the only way I see how we can currently support media in credentials/proofs is by including the entire contents of media in a raw form as a credential attribute value. However couldn't that become burdensome especially with larger media items, wouldn't a reference like a hash (I realize the current indy-sdk doesnt support this yet) be a better solution? In that case we would need the attachments region for attachment of the actual media as a link to the hash. 

Personally I think if we are trying to create a generic credential exchange family, perhaps we should be using W3VC as the standard and continuing the effort for indy to become compatible with that format and in the mean time have a credential exchange family for indy based credentials that gets deprecated later?",2019-02-13 00:53:46,2019-02-13 00:53:46
https://api.github.com/repos/hyperledger/indy-hipe/issues/89,https://api.github.com/repos/hyperledger/indy-hipe/issues/comments/463120130,https://github.com/hyperledger/indy-hipe/pull/89#issuecomment-463120130,jovfer,"> wouldn't a reference like a hash (I realize the current indy-sdk doesnt support this yet) be a better solution?

@tplooker Could you explain ""doesnt support"" more explicitly? I don't see any blockers for indy users (applications on all (issuer, proover, verifier sides) to create schema with attribute like ""personal_photo_hash_ref"" and use it.",2019-02-13 09:15:48,2019-02-13 09:15:59
https://api.github.com/repos/hyperledger/indy-hipe/issues/89,https://api.github.com/repos/hyperledger/indy-hipe/issues/comments/463120463,https://github.com/hyperledger/indy-hipe/pull/89#issuecomment-463120463,jovfer,"@tplooker BTW this topic more related to attachment content in some messages of proposed family, so it's related to this topic but a bit out of scope this HIPE I think. isn't it?
And in general there is long-term plan to support format o W3VC credentials in indy ecosystem, but I think it's the next step. @dhh1128 could you share your thoughts please?",2019-02-13 09:16:44,2019-02-13 09:16:44
https://api.github.com/repos/hyperledger/indy-hipe/issues/89,https://api.github.com/repos/hyperledger/indy-hipe/issues/comments/463268316,https://github.com/hyperledger/indy-hipe/pull/89#issuecomment-463268316,TelegramSam,"It seems like the main reason for utilizing attachments is to differentiate between the format of the message and the format of data carried inside the message. This makes sense when the encoding is entirely different but carries an unnecessarily high overhead when the format of the internal data is JSON. I believe json-ld shows us a better example here, where the type of an internal block of data can be independent of the type of the outer message. I believe we should adopt that pattern here as well, and include the appropriate `@type` inside the internal JSON data format. This allows movement of the internal type without requiring a message family update. 

Thoughts?",2019-02-13 16:31:45,2019-02-13 16:31:45
https://api.github.com/repos/hyperledger/indy-hipe/issues/89,https://api.github.com/repos/hyperledger/indy-hipe/issues/comments/463296357,https://github.com/hyperledger/indy-hipe/pull/89#issuecomment-463296357,tplooker,"@TelegramSam I agree if, we want the credential exchange message family to be generic but want to preserve versioning and updating of the internal indy based credential messages we would need that support.

@jovfer if we are sending say a libindy-proof that discloses a `personal_photo_hash_ref` from a credential, how can we include the actual photo in the same message? Because the libindy-proof would be sent as an attachment to the to the presentation message, the photo couldn't also be sent as an attachment?",2019-02-13 17:45:21,2019-02-13 17:45:21
https://api.github.com/repos/hyperledger/indy-hipe/issues/89,https://api.github.com/repos/hyperledger/indy-hipe/issues/comments/464178867,https://github.com/hyperledger/indy-hipe/pull/89#issuecomment-464178867,TelegramSam,Can you provide examples of what the contents of the attachments look like?,2019-02-15 19:55:07,2019-02-15 19:55:07
https://api.github.com/repos/hyperledger/indy-hipe/issues/89,https://api.github.com/repos/hyperledger/indy-hipe/issues/comments/468350765,https://github.com/hyperledger/indy-hipe/pull/89#issuecomment-468350765,TelegramSam,"Feedback from the connectathon: It seems only the credential artifacts themselves should be presented as a block of data. Requests and other flow items would be useful directly as message attributes, not as attachments.",2019-02-28 16:58:07,2019-02-28 16:58:07
https://api.github.com/repos/hyperledger/indy-hipe/issues/89,https://api.github.com/repos/hyperledger/indy-hipe/issues/comments/468760810,https://github.com/hyperledger/indy-hipe/pull/89#issuecomment-468760810,jovfer,@tplooker are you agree with @TelegramSam 's summary or would like to add more items?,2019-03-01 18:21:06,2019-03-01 18:21:06
https://api.github.com/repos/hyperledger/indy-hipe/issues/89,https://api.github.com/repos/hyperledger/indy-hipe/issues/comments/468761996,https://github.com/hyperledger/indy-hipe/pull/89#issuecomment-468761996,jovfer,"@TelegramSam @tplooker FYI 
Me and @dhh1128 have some doubts about steps in credential issuance flow.
I think there is a chance that some messages will have to has both direct attributes and attachment. Like there is a math data about key correctness proof.",2019-03-01 18:24:49,2019-03-01 18:24:49
https://api.github.com/repos/hyperledger/indy-hipe/issues/89,https://api.github.com/repos/hyperledger/indy-hipe/issues/comments/468820170,https://github.com/hyperledger/indy-hipe/pull/89#issuecomment-468820170,tplooker,@jovfer what @TelegramSam said yes that was my impression from the connectathon. Can you elaborate some more about your and @dhh1128 concerns?,2019-03-01 21:36:35,2019-03-01 21:36:35
https://api.github.com/repos/hyperledger/indy-hipe/issues/89,https://api.github.com/repos/hyperledger/indy-hipe/issues/comments/469779541,https://github.com/hyperledger/indy-hipe/pull/89#issuecomment-469779541,TelegramSam,"> @TelegramSam @tplooker FYI
> Me and @dhh1128 have some doubts about steps in credential issuance flow.
> I think there is a chance that some messages will have to has both direct attributes and attachment. Like there is a math data about key correctness proof.

I have zero problems with both attachment and attributes being used.",2019-03-05 17:42:44,2019-03-05 17:42:44
https://api.github.com/repos/hyperledger/indy-hipe/issues/89,https://api.github.com/repos/hyperledger/indy-hipe/issues/comments/474663106,https://github.com/hyperledger/indy-hipe/pull/89#issuecomment-474663106,kdenhartog,"I'd like to see a `credential_format` attribute added. For one, this would allow this message family to be decoupled from the specific format making it a general credential exchange protocol. Second, it allows Indy agents to support issuing multiple credential formats (e.g. JWS, JSON-LD sigs, etc) and can be extended (e.g. threshold ABC credentials) without requiring changes to the protocol.",2019-03-20 02:48:54,2019-03-20 02:48:54
https://api.github.com/repos/hyperledger/indy-hipe/issues/89,https://api.github.com/repos/hyperledger/indy-hipe/issues/comments/475037806,https://github.com/hyperledger/indy-hipe/pull/89#issuecomment-475037806,swcurran,"@KitHat -

The indy-agent call focused on this HIPE today.  Here is a list of the changes requested to this HIPE from the call.  It would be great if you could make the changes as soon as is reasonable, so we can continue the discussion:

* Add `credential-proposal` (name may change) message when `credential-offer` doesn’t match needs of the prover (rather than using `credential-request` for that purpose).
     * Loop Offer/Proposal till Prover is satisfied and sends `credential-request` message.
     * Remove `credential-preview` from `credential-request` message
     * Update diagram accordingly - BTW - big kudos on the call about the diagrams!!
     * Same concept for the credential-presentation flow
* `credential-offer` changes
     * “offers” as attribute, with array of JSON-LD typed structs.
     * Make a comparable update to the libindy data structs in all of the messages - credential issuance and presentation.
* Parent Threading paragraph needs correction/clarification in this context. What is described is when you want to start another protocol separate from this one and then return to this one, you should use a pthid.  If you are just responding to a message on this thread, you keep the same thid, and adjust the thread parameters as appropriate.
     * Should threading be added explicitly to every message past offer?
* Rename the “credential” message to “credential-issue”
* Remove the `credential-ack` and `credential-reject` messages in favor of adopting standard messages.
      * In doing that, identify the error codes that would be expected in the Problem Report message.
* Remove references in HIPE to payment until it’s a more baked concept.  That can go into a separate version of the HIPE.",2019-03-20 21:35:10,2019-03-20 21:42:04
